{
  "schemaVersion": 1,
  "generatedAt": "2026-07-15T00:00:00.000Z",
  "summary": {
    "total": 5,
    "passed": 4,
    "failed": 1
  },
  "cases": [
    {
      "id": "eval-product-truth-topic",
      "description": "The product-truth topic should return the agentic commerce article.",
      "passed": true,
      "query": {
        "topic": "product-truth"
      },
      "expected": {
        "slugs": [
          "agentic-commerce-product-truth"
        ],
        "notSlugs": [
          "agent-auditable-research"
        ]
      },
      "actual": {
        "slugs": [
          "agentic-commerce-product-truth"
        ],
        "claimIds": [
          "article:agentic-commerce-product-truth:claim-001",
          "article:agentic-commerce-product-truth:claim-002",
          "article:agentic-commerce-product-truth:claim-003",
          "article:agentic-commerce-product-truth:claim-004",
          "article:agentic-commerce-product-truth:claim-005",
          "article:agentic-commerce-product-truth:claim-006",
          "article:agentic-commerce-product-truth:claim-007",
          "article:agentic-commerce-product-truth:claim-008",
          "article:agentic-commerce-product-truth:claim-009",
          "article:agentic-commerce-product-truth:claim-010",
          "article:agentic-commerce-product-truth:claim-011",
          "article:agentic-commerce-product-truth:claim-012",
          "article:agentic-commerce-product-truth:claim-013",
          "article:agentic-commerce-product-truth:claim-014",
          "article:agentic-commerce-product-truth:claim-015"
        ]
      },
      "failures": []
    },
    {
      "id": "eval-ai-native-publishing-topic",
      "description": "The ai-native-publishing topic should return the auditable research article.",
      "passed": true,
      "query": {
        "topic": "ai-native-publishing"
      },
      "expected": {
        "slugs": [
          "agent-auditable-research"
        ],
        "notSlugs": [
          "agentic-commerce-product-truth"
        ]
      },
      "actual": {
        "slugs": [
          "agent-auditable-research"
        ],
        "claimIds": [
          "article:agent-auditable-research:claim-001",
          "article:agent-auditable-research:claim-002",
          "article:agent-auditable-research:claim-003",
          "article:agent-auditable-research:claim-004",
          "article:agent-auditable-research:claim-005",
          "article:agent-auditable-research:claim-006"
        ]
      },
      "failures": []
    },
    {
      "id": "eval-keyword-agent",
      "description": "A keyword search for 'agent' should match both published articles.",
      "passed": true,
      "query": {
        "keyword": "agent"
      },
      "expected": {
        "slugs": [
          "agent-auditable-research",
          "agentic-commerce-product-truth"
        ]
      },
      "actual": {
        "slugs": [
          "agent-auditable-research",
          "agent-control-planes",
          "agentic-commerce-product-truth",
          "agents",
          "ai-agent-advanced-questions",
          "ai-agent-first-conversation",
          "ai-delegation-orchestration",
          "ai-delegation-orchestration-01-from-conversation-to-delegation",
          "ai-delegation-orchestration-02-the-delegation-record",
          "ai-delegation-orchestration-03-the-operator-cockpit-problem",
          "ai-delegation-orchestration-04-control-loci-not-human-managers",
          "ai-delegation-orchestration-05-long-running-delegations",
          "ai-delegation-orchestration-06-capability-contracts-for-agent-networks",
          "ai-delegation-orchestration-07-commitment-boundaries-in-high-stakes-domains",
          "ai-demystified",
          "audio-first-voice-consumption",
          "context-management",
          "evaluations",
          "fine-tuning",
          "historical-hinges-access-is-not-benefit",
          "long-running-sessions",
          "loops-vs-goals",
          "memory-vs-context",
          "multi-agent-systems",
          "planning-and-reflection",
          "product-ideas-that-could-shift-incentives",
          "prompt-caching",
          "prompt-engineering",
          "reasoning-models",
          "retrieval-augmented-generation",
          "tool-use"
        ],
        "claimIds": [
          "article:agent-auditable-research:claim-001",
          "article:agent-auditable-research:claim-002",
          "article:agent-auditable-research:claim-003",
          "article:agent-auditable-research:claim-004",
          "article:agent-auditable-research:claim-005",
          "article:agent-auditable-research:claim-006",
          "article:agent-control-planes:claim-001",
          "article:agent-control-planes:claim-002",
          "article:agent-control-planes:claim-003",
          "article:agent-control-planes:claim-004",
          "article:agent-control-planes:claim-005",
          "article:agent-control-planes:claim-006",
          "article:agent-control-planes:claim-007",
          "article:agent-control-planes:claim-008",
          "article:agentic-commerce-product-truth:claim-001",
          "article:agentic-commerce-product-truth:claim-002",
          "article:agentic-commerce-product-truth:claim-003",
          "article:agentic-commerce-product-truth:claim-004",
          "article:agentic-commerce-product-truth:claim-005",
          "article:agentic-commerce-product-truth:claim-006",
          "article:agentic-commerce-product-truth:claim-007",
          "article:agentic-commerce-product-truth:claim-008",
          "article:agentic-commerce-product-truth:claim-009",
          "article:agentic-commerce-product-truth:claim-010",
          "article:agentic-commerce-product-truth:claim-011",
          "article:agentic-commerce-product-truth:claim-012",
          "article:agentic-commerce-product-truth:claim-013",
          "article:agentic-commerce-product-truth:claim-014",
          "article:agentic-commerce-product-truth:claim-015",
          "article:agents:claim-001",
          "article:agents:claim-002",
          "article:agents:claim-003",
          "article:agents:claim-004",
          "article:agents:claim-005",
          "article:ai-agent-advanced-questions:claim-001",
          "article:ai-agent-advanced-questions:claim-002",
          "article:ai-agent-advanced-questions:claim-003",
          "article:ai-agent-advanced-questions:claim-004",
          "article:ai-agent-advanced-questions:claim-005",
          "article:ai-agent-advanced-questions:claim-006",
          "article:ai-agent-advanced-questions:claim-007",
          "article:ai-agent-first-conversation:claim-001",
          "article:ai-agent-first-conversation:claim-002",
          "article:ai-agent-first-conversation:claim-003",
          "article:ai-agent-first-conversation:claim-004",
          "article:ai-delegation-orchestration:claim-001",
          "article:ai-delegation-orchestration-01-from-conversation-to-delegation:claim-001",
          "article:ai-delegation-orchestration-02-the-delegation-record:claim-001",
          "article:ai-delegation-orchestration-03-the-operator-cockpit-problem:claim-001",
          "article:ai-delegation-orchestration-04-control-loci-not-human-managers:claim-001",
          "article:ai-delegation-orchestration-05-long-running-delegations:claim-001",
          "article:ai-delegation-orchestration-06-capability-contracts-for-agent-networks:claim-001",
          "article:ai-delegation-orchestration-07-commitment-boundaries-in-high-stakes-domains:claim-001",
          "article:ai-demystified:claim-001",
          "article:ai-demystified:claim-002",
          "article:ai-demystified:claim-003",
          "article:audio-first-voice-consumption:claim-001",
          "article:audio-first-voice-consumption:claim-002",
          "article:audio-first-voice-consumption:claim-003",
          "article:audio-first-voice-consumption:claim-004",
          "article:audio-first-voice-consumption:claim-005",
          "article:audio-first-voice-consumption:claim-006",
          "article:audio-first-voice-consumption:claim-007",
          "article:context-management:claim-001",
          "article:context-management:claim-002",
          "article:context-management:claim-003",
          "article:context-management:claim-004",
          "article:evaluations:claim-001",
          "article:evaluations:claim-002",
          "article:evaluations:claim-003",
          "article:evaluations:claim-004",
          "article:fine-tuning:claim-001",
          "article:fine-tuning:claim-002",
          "article:fine-tuning:claim-003",
          "article:fine-tuning:claim-004",
          "article:historical-hinges-access-is-not-benefit:claim-001",
          "article:historical-hinges-access-is-not-benefit:claim-002",
          "article:historical-hinges-access-is-not-benefit:claim-003",
          "article:historical-hinges-access-is-not-benefit:claim-004",
          "article:long-running-sessions:claim-001",
          "article:long-running-sessions:claim-002",
          "article:long-running-sessions:claim-003",
          "article:long-running-sessions:claim-004",
          "article:long-running-sessions:claim-005",
          "article:loops-vs-goals:claim-001",
          "article:loops-vs-goals:claim-002",
          "article:loops-vs-goals:claim-003",
          "article:loops-vs-goals:claim-004",
          "article:memory-vs-context:claim-001",
          "article:memory-vs-context:claim-002",
          "article:memory-vs-context:claim-003",
          "article:memory-vs-context:claim-004",
          "article:multi-agent-systems:claim-001",
          "article:multi-agent-systems:claim-002",
          "article:multi-agent-systems:claim-003",
          "article:multi-agent-systems:claim-004",
          "article:planning-and-reflection:claim-001",
          "article:planning-and-reflection:claim-002",
          "article:planning-and-reflection:claim-003",